{
  "schemaVersion": "signing-checklist",
  "stage": "signing",
  "contentVersion": "2.1.0",
  "updatedAt": "2026-05-30T00:00:00Z",
  "categories": [
    {
      "code": "identity_authorization",
      "label": "身份、授权与房源可出租性",
      "items": [
        {
          "code": "counterparty_identity",
          "label": "签约对方身份是否明确",
          "oneLine": "签约前必须确认对方是房东本人、代理人、二房东、中介还是住房租赁企业。",
          "whyCheck": "签错对象会影响合同效力、押金追回和后续维权。",
          "howToCheck": [
            "核对姓名、身份证号、手机号、微信号和收款方。",
            "确认合同甲方、产权人、实际收款方是否一致。",
            "尽量与房主本人直签。"
          ],
          "riskSignals": [
            "只愿口头说明身份，不提供任何材料。",
            "合同甲方、产权人、收款方不一致且解释不清。",
            "让租客先付款再补合同或补材料。"
          ],
          "captureAdvice": [
            "身份证复印件或身份说明截图。",
            "聊天中对方身份说明截图。",
            "收款账户截图。"
          ],
          "recordAdvice": "记录对方身份、联系方式、收款账户和对应说明。",
          "referenceLinks": [
            {
              "title": "市场监管总局合同示范文本库",
              "url": "https://htsfwb.samr.gov.cn/View?id=2340996b-882d-47a4-b74d-c30784628737",
              "note": "房屋租赁合同示范文本参考"
            }
          ],
          "priority": "high",
          "analysisMapping": {
            "dimensions": [
              "ownershipAuthorization"
            ]
          }
        },
        {
          "code": "rental_authority",
          "label": "对方是否有合法出租授权",
          "oneLine": "不是产权人本人签约时，要确认对方是否有合法出租授权。",
          "whyCheck": "二房东、代理人或机构无授权出租时，租客可能面临合同争议和腾退风险。",
          "howToCheck": [
            "要求查看房产证中体现房号和产权人的页面。",
            "核对房屋地址、房间号、建筑面积、产权信息是否与合同一致。",
            "对二房东或代理人，要求提供产权人授权材料。"
          ],
          "riskSignals": [
            "只说“我是亲戚”“我是代理”但无授权。",
            "房产证地址、房号和实际看房不一致。",
            "产权人为多人但没有共有权人同意出租说明。"
          ],
          "captureAdvice": [
            "房产证关键信息页截图。",
            "授权材料截图。",
            "合同房屋信息页截图。"
          ],
          "recordAdvice": "记录房产证信息、授权关系和材料缺口。",
          "referenceLinks": [
            {
              "title": "住房租赁条例",
              "url": "https://www.mee.gov.cn/zcwj/gwywj/202507/t20250722_1123995.shtml",
              "note": "住房租赁实名签约、备案和出租管理"
            }
          ],
          "priority": "high",
          "analysisMapping": {
            "dimensions": [
              "ownershipAuthorization"
            ]
          }
        },
        {
          "code": "property_rights_risk",
          "label": "房屋权利状态是否存在风险",
          "oneLine": "签约前要确认房屋是否存在抵押、居住权、查封、产权纠纷或其他影响出租的风险。",
          "whyCheck": "权利状态不清可能影响正常入住、续租和后续维权。",
          "howToCheck": [
            "询问房屋是否抵押、是否设立居住权、是否有产权争议。",
            "要求合同中写明出租人保证房屋可依法出租。",
            "如对材料有疑问，先暂停付款。"
          ],
          "riskSignals": [
            "房东回避产权问题。",
            "合同不写房屋可出租性保证。",
            "房源涉及多人共有但只有一人签字。"
          ],
          "captureAdvice": [
            "合同房屋权利保证条款截图。",
            "聊天确认截图。"
          ],
          "recordAdvice": "记录对方对抵押、居住权和产权状态的承诺。",
          "referenceLinks": [
            {
              "title": "市场监管总局合同示范文本库",
              "url": "https://htsfwb.samr.gov.cn/View?id=2340996b-882d-47a4-b74d-c30784628737",
              "note": "合同中的房屋权属和承诺条款"
            }
          ],
          "priority": "high",
          "analysisMapping": {
            "dimensions": [
              "ownershipAuthorization"
            ]
          }
        },
        {
          "code": "property_match",
          "label": "签约房源是否与看房房源一致",
          "oneLine": "防止合同地址、房号或附属空间不一致。",
          "whyCheck": "合同房源与实际看房不一致会导致后续权益纠纷。",
          "howToCheck": [
            "核对合同中的地址、房号、面积与实际看房是否一致。",
            "确认附属空间（车位、储物间等）是否写入合同。"
          ],
          "riskSignals": [
            "合同地址与实际看房地址不同。",
            "房号或面积与看房时不一致。"
          ],
          "captureAdvice": [
            "核对合同中的地址与房号。",
            "合同房屋信息页截图。"
          ],
          "recordAdvice": "记录合同房源信息与实际看房的差异。",
          "referenceLinks": [
            {
              "title": "商品房屋租赁管理办法",
              "url": "https://www.gov.cn/gongbao/content/2011/content_1813498.htm",
              "note": "租赁合同标的物应与实际房屋一致"
            }
          ],
          "priority": "high",
          "analysisMapping": {
            "dimensions": [
              "ownershipAuthorization"
            ]
          }
        }
      ]
    },
    {
      "code": "filing_local_rules",
      "label": "合同备案、居住证与地区规则",
      "items": [
        {
          "code": "lease_filing",
          "label": "是否办理网签或租赁备案",
          "oneLine": "合同应实名签订，并尽量通过当地住房租赁管理服务平台办理网签或备案。",
          "whyCheck": "备案会影响居住证、公共服务和后续维权证据链。",
          "howToCheck": [
            "询问房东是否配合办理租赁备案。",
            "如果出租人不办理，确认当地是否允许承租人办理。",
            "记录所租城市、区县或街道的具体要求。"
          ],
          "riskSignals": [
            "房东明确拒绝备案但不说明原因。",
            "需要办居住证、陪读或入学材料，但合同不配合备案。"
          ],
          "captureAdvice": [
            "备案平台说明截图。",
            "房东配合备案的聊天确认截图。"
          ],
          "recordAdvice": "记录是否需要备案、谁办理、何时办理、需要哪些材料。",
          "referenceLinks": [
            {
              "title": "住房租赁条例",
              "url": "https://www.mee.gov.cn/zcwj/gwywj/202507/t20250722_1123995.shtml",
              "note": "实名签订合同、住房租赁管理服务平台和备案"
            }
          ],
          "priority": "high",
          "analysisMapping": {
            "dimensions": [
              "ownershipAuthorization"
            ]
          }
        },
        {
          "code": "local_special_use",
          "label": "地方性限制和特殊用途是否写清",
          "oneLine": "办居住证、陪读、病人陪床、宠物、孩子、改造等特殊用途应在合同或补充约定中写明。",
          "whyCheck": "特殊用途通常涉及房东配合、稳定租期和额外限制，口头确认不够。",
          "howToCheck": [
            "明确自己是否需要居住证、入学材料、医院陪护便利、宠物友好或儿童友好。",
            "把房东需要配合的事项写入补充约定。"
          ],
          "riskSignals": [
            "房东口头说可以，合同里不写。",
            "入住后才发现不允许宠物、不能办居住证、不能改造。"
          ],
          "captureAdvice": [
            "补充协议截图。",
            "聊天确认截图。"
          ],
          "recordAdvice": "记录特殊用途和对应需要对方配合的事项。",
          "referenceLinks": [
            {
              "title": "住房租赁条例",
              "url": "https://www.mee.gov.cn/zcwj/gwywj/202507/t20250722_1123995.shtml",
              "note": "租赁合同条款和特殊用途约定"
            }
          ],
          "priority": "medium",
          "analysisMapping": {
            "dimensions": [
              "ownershipAuthorization"
            ]
          }
        }
      ]
    },
    {
      "code": "rent_deposit_cycle",
      "label": "租金、押金与付款周期",
      "items": [
        {
          "code": "rent_deposit_payment_cycle",
          "label": "房租、押金和付款周期是否写清",
          "oneLine": "房租金额、押金金额、付款周期、付款时间和收款账户必须写入合同。",
          "whyCheck": "付款口径不清会直接造成押金、租金和违约争议。",
          "howToCheck": [
            "核对房租金额、押金金额、押几付几、月付或季付、固定交租日。",
            "所有金额尽量大小写同时写明。",
            "核对合同收款账户与实际转账对象。"
          ],
          "riskSignals": [
            "合同只写“按约支付”，没有具体金额和日期。",
            "房租和押金转给不同主体但未说明。",
            "临签时变更押付方式。"
          ],
          "captureAdvice": [
            "租金押金条款截图。",
            "收款账户截图。",
            "转账备注截图。"
          ],
          "recordAdvice": "摘录租金、押金、支付周期和收款账户。",
          "referenceLinks": [
            {
              "title": "市场监管总局合同示范文本库",
              "url": "https://htsfwb.samr.gov.cn/View?id=2340996b-882d-47a4-b74d-c30784628737",
              "note": "租金、押金、付款条款参考"
            }
          ],
          "priority": "high",
          "analysisMapping": {
            "dimensions": [
              "paymentTerms"
            ]
          }
        }
      ]
    },
    {
      "code": "fund_security",
      "label": "资金安全和支付方式",
      "items": [
        {
          "code": "rent_loan_risk",
          "label": "是否存在租金贷、押金分期或免押陷阱",
          "oneLine": "押零付一、免押、押金分期、租金月付优惠等说法，要确认是否绑定贷款或信用授权。",
          "whyCheck": "一些“低门槛付款”实际可能是租金贷、消费贷或自动扣款授权。",
          "howToCheck": [
            "看是否要求下载金融 App、做人脸识别、签分期协议、授权自动扣款。",
            "询问是否产生贷款、征信、服务费、手续费或违约费用。",
            "不理解协议前不要签。"
          ],
          "riskSignals": [
            "合同之外另签“分期服务协议”。",
            "不说贷款，只说“系统流程”。",
            "免押需要开通信贷或信用授权。"
          ],
          "captureAdvice": [
            "金融 App 页面截图。",
            "分期协议截图。",
            "自动扣款授权截图。"
          ],
          "recordAdvice": "记录所有付款相关协议名称和付款链路。",
          "referenceLinks": [
            {
              "title": "中国政府网住房租赁资金监管相关政策解读",
              "url": "https://www.gov.cn/fuwu/2021-04/28/content_5603351.htm",
              "note": "住房租赁企业资金监管和租金贷风险"
            }
          ],
          "priority": "high",
          "analysisMapping": {
            "dimensions": [
              "paymentTerms"
            ]
          }
        },
        {
          "code": "fund_supervision",
          "label": "押金托管和租金监管是否明确",
          "oneLine": "通过长租公寓、住房租赁企业或二房东机构租房时，要确认押金托管和租金监管。",
          "whyCheck": "机构跑路、资金挪用和长期预付风险通常集中在资金监管薄弱处。",
          "howToCheck": [
            "询问押金是否托管、租金是否进入监管账户。",
            "如果一次性支付超过 3 个月租金，或押金明显超过当地常见标准，要额外确认监管规则。",
            "核对付款账户是否为合同约定账户。"
          ],
          "riskSignals": [
            "要求一次性付长周期租金但不说明监管。",
            "押金直接进入个人账户。",
            "机构回避资金监管问题。"
          ],
          "captureAdvice": [
            "监管账户说明截图。",
            "付款账户截图。",
            "押金托管说明截图。"
          ],
          "recordAdvice": "记录监管账户、托管说明、付款周期和退费规则。",
          "referenceLinks": [
            {
              "title": "北京市住房租赁资金监管常见问题",
              "url": "https://zjw.beijing.gov.cn/bjjs/fwgl/fwzlfw60/cjwt69/743736548/index.shtml",
              "note": "押金托管、租金监管、支付周期参考"
            }
          ],
          "priority": "high",
          "analysisMapping": {
            "dimensions": [
              "paymentTerms"
            ]
          }
        }
      ]
    },
    {
      "code": "lease_term_exit",
      "label": "租期、续租、退租与违约",
      "items": [
        {
          "code": "lease_term_delivery",
          "label": "租期起止、交付和免租期是否明确",
          "oneLine": "租期起止、入住日期、交付时间和免租缓冲期要写清。",
          "whyCheck": "交付不清会影响搬家、清洁、维修和首期租金计算。",